start	end	text
3121360	3123360	se haya dado en el corpus.
3125360	3127360	¿Sí?
3127360	3129360	Y usted fíjense
3131360	3133360	que nosotros lo que vemos
3133360	3135360	son las observaciones.
3135360	3137360	No vemos los TAQs, obviamente.
3137360	3139360	Por eso se llama modelos tabulos
3139360	3141360	porque se llama modelos tabulos.
3145360	3147360	Para solucionar este problema
3147360	3149360	los GDMarco model
3149360	3151360	¿Se acuerdan que
3151360	3153360	los modelos vallesianos
3153360	3155360	como
3155360	3157360	simplificación que los TAQs
3157360	3159360	eran independientes entre ellos?
3159360	3161360	¿Se acuerdan?
3161360	3163360	Bueno, los GDMarco model hacen
3163360	3165360	dos simplificaciones que son bestiales
3165360	3167360	que es increíble que funcionen
3167360	3169360	y es. La primera
3169360	3171360	dicen bueno
3171360	3173360	yo para simplificar digo que
3173360	3175360	la probabilidad de que
3175360	3177360	una palabra ocurra
3177360	3179360	de que se emita
3179360	3181360	solo depende de la etiqueta.
3181360	3183360	¿Sí?
3183360	3185360	Es decir
3185360	3187360	que esto sea la o el
3187360	3189360	no depende del contexto.
3191360	3193360	¿Aguardo?
3193360	3195360	Es una simplificación muy fuerte ¿no?
3197360	3199360	Entonces esta probabilidad
3199360	3201360	es mucho más sencilla
3203360	3205360	porque es la probabilidad
3205360	3207360	de cada palabra dado su contexto
3207360	3209360	dado su TAQ
3211360	3213360	¿Sí? ¿De acuerdo?
3215360	3217360	¿Por qué?
3217360	3219360	Porque esto es probabilidad
3219360	3221360	W1n
3221360	3223360	dado T1n
3223360	3225360	es igual como son independientes
3225360	3227360	la probabilidad de W1n
3227360	3229360	es dado
3233360	3235360	perdón
3235360	3237360	la probabilidad de W1 dado T1n
3241360	3243360	pero como cada palabra
3243360	3245360	depende
3245360	3247360	porque las palabras
3247360	3249360	son independientes entre ciertas
3249360	3251360	¿Cómo es diciendo?
3271360	3273360	Esto
3273360	3275360	yo lo asumo
3275360	3277360	por la segunda regla
3277360	3279360	porque las etiquetas
3279360	3281360	las categorías solo dependen entre ellas
3281360	3283360	las palabras son independientes entre sí
3283360	3285360	entonces
3285360	3287360	y además la otra
3287360	3289360	es que
3289360	3291360	esto de lo que se llama
3291360	3293360	hipótesis marcoviana
3293360	3295360	que es
3295360	3297360	la probabilidad de que una etiqueta ocurra
3297360	3299360	depende solo de la previa
3299360	3301360	es muy simplificador
3301360	3303360	lo único que me condiciona
3303360	3305360	que acá hay un adjetivo
3305360	3307360	es que
3307360	3309360	antes hubo un determinante
3309360	3311360	si bien
3311360	3313360	yo estoy generando una cadena
3313360	3315360	es una cadena como muy sencilla
3317360	3319360	que tiene muy fuerte simplificación
3321360	3323360	¿Por qué hacemos eso y bueno
3323360	3325360	para volverlo computacionalmente posible?
3325360	3327360	simplemente
3329360	3331360	porque yo teniendo eso puedo empezar a contar
3331360	3333360	porque
3333360	3335360	es mucho más fácil saber decir
3335360	3337360	cuántas veces untaba parecido después de otro
3337360	3339360	es un número
3339360	3341360	que es mucho más contable en un cuerpo
3341360	3343360	y lo mismo cuántas veces
3343360	3345360	emitió la palabra porque yo quiero saber
3345360	3347360	esta pregunta
3347360	3349360	el determinante gelo la es más fácil
3349360	3351360	puedo contar y tengo
3351360	3353360	10.000 veces fue el
3353360	3355360	8.500 fue la y etc
3355360	3357360	3.200 fue
3357360	3359360	un y así
3359360	3361360	entonces
3361360	3363360	lo que llegamos acá
3363360	3365360	el modelo de Markov de estado oculto es
3367360	3369360	la secuencia de tags es la que maximiza
3369360	3371360	esto
3371360	3373360	que es más o menos
3373360	3375360	porque dice estas simplificaciones
3377360	3379360	maximiza
3379360	3381360	la probabilidad de la palabra
3381360	3383360	por el tag de la dotar anterior
3383360	3385360	esto es el modelo de Markov de estado oculto
3387360	3389360	aplicado al análisis lexy
3393360	3395360	se entiende más o menos
3401360	3403360	y cómo calculamos
3403360	3405360	la probabilidad de transición
3405360	3407360	y bueno
3407360	3409360	contando
3409360	3411360	la probabilidad
3413360	3415360	dado que tenga un tag
3415360	3417360	otro por ejemplo la probabilidad de que
3417360	3419360	dado un determinante venga un verbo
3425360	3427360	es simplemente contar
3427360	3429360	la cantidad de veces que apareció
3429360	3431360	un determinante y un verbo
3431360	3433360	dividido la cantidad de veces que apareció un determinante
3433360	3435360	cuántas veces
3435360	3437360	el determinante
3437360	3439360	estuvo seguido un verbo
3439360	3441360	¿se acuerdan cómo se llamaba esto?
3441360	3443360	estimar esto
3444360	3446360	se llamaba estimar
3446360	3448360	por medio del principio
3448360	3450360	de máxima verosimilitud
3450360	3452360	y eso se llama un estimador de máxima
3452360	3454360	verosimilitud
3461360	3463360	maximum likelihood
3463360	3465360	en inglés
3467360	3468360	bueno entonces
3468360	3470360	acá hicimos la cuenta y dijimos
3470360	3472360	¿qué pasa con Reis?
3473360	3475360	Reis
3475360	3477360	yo puedo calcular la probabilidad
3477360	3479360	que sea un nombre
3479360	3481360	dado que antes había un determinante
3481360	3483360	¿se acuerda?
3487360	3489360	antes hay un tú
3493360	3495360	acá esto es una cuenta
3495360	3497360	no, perdón, no tiene que ver con la solución
3497360	3499360	yo
3499360	3501360	también ¿cómo aplico esto
3501360	3503360	a una intuición que yo tengo?
3503360	3505360	bueno, los determinantes suelen presentar
3505360	3507360	adjetivos y nombres, entonces la probabilidad
3507360	3509360	de que haya un nombre después de un determinante
3509360	3511360	o un adjetivo deberían ser altas
3511360	3513360	y efectivamente en el Corpus Brown
3513360	3515360	la mitad de las veces después
3515360	3517360	de un determinante viene un nombre
3517360	3519360	y acá
3527360	3529360	y acá tenemos la probabilidad
3529360	3531360	de que
3533360	3535360	por ejemplo
3535360	3537360	dado que hay un verbo
3537360	3539360	bbz creo que era conjugado
3539360	3541360	sea is
3541360	3543360	el verbo de esta la probabilidad de misión
3543360	3545360	y es 047
3545360	3547360	la mayoría de las veces el verbo
3547360	3549360	de ser en inglés
3549360	3551360	empiezo a sacar conclusión a partir
3551360	3553360	del corpus anotado
3555360	3557360	entonces, yo quiero resolver
3557360	3559360	este problema
3559360	3561360	yo podría llegar a modelarlo
3561360	3563360	a esto
3563360	3565360	como un
3565360	3567360	como un modelo
3567360	3569360	que marcó de estado oculto, es decir
3569360	3571360	como lo que se llama un gráfico del modelo
3571360	3573360	un grafo que modela las probabilidades
3573360	3575360	acá lo que estamos diciendo
3575360	3577360	es que
3577360	3579360	la palabra
3579360	3581360	solo depende del tag
3581360	3583360	y que cada tag depende del anterior
3583360	3585360	esta es una forma gráfica a través de grafos
3585360	3587360	de modelar y toda una teoría
3587360	3589360	que se llama graphical models
3589360	3591360	que estudia
3591360	3593360	cómo representar probabilidades a través de grafos
3595360	3597360	y acá lo que tenemos es
3597360	3599360	lo que estamos diciendo es
3599360	3601360	lo único que incide en esto
3601360	3603360	es la categoría armatical
3603360	3605360	y lo único que incide
3605360	3607360	en cada categoría armatical es el anterior
3607360	3609360	y yo lo que trato de hacer
3609360	3611360	es buscar
3611360	3613360	cuál de estas dos es la mejor
3613360	3615360	para esta
3615360	3617360	secuencia
3617360	3619360	¿de acuerdo?
3619360	3621360	lo estoy pensando como un proceso donde yo tengo estados
3621360	3623360	que están ocultos, que son estos
3623360	3625360	yo quiero calcular
3625360	3627360	probabilidades de transición entre ellos
3627360	3629360	yo quiero sacar la probabilidad de transición acá
3631360	3633360	pero lo que yo veo son las palabras
3633360	3635360	no veo los estados
3635360	3637360	¿de acuerdo?
3637360	3639360	entonces yo a partir
3639360	3641360	de lo que veo
3641360	3643360	con el tag asociado
3643360	3645360	necesito inferir
3645360	3647360	cuál es el mejor cual es
3647360	3649360	la probabilidad de tocar arriba
3655360	3657360	entonces
3657360	3659360	si queremos desambiguar reis
3659360	3661360	necesitamos saber
3663360	3665360	la probabilidad
3667360	3669360	fíjense que las probabilidades
3669360	3671360	que me interesan a mí en este caso
3671360	3673360	son
3675360	3677360	estas que están marcadas negritas
3677360	3679360	esta
3679360	3681360	esta
3681360	3683360	y esta
3683360	3685360	las otras son comunes
3685360	3687360	o sea que no me importan
3687360	3689360	me van a dar lo mismo
3691360	3693360	entonces yo voy a calcular estas probabilidades
3697360	3699360	y ahí están
3699360	3701360	la probabilidad que sea un nombre
3701360	3703360	que después de tu
3703360	3705360	venga un nombre que es muy baja
3705360	3707360	y que venga un verbo muy alta
3711360	3713360	pero en cambio
3713360	3715360	reis como nombre
3715360	3717360	es mucho más común
3717360	3719360	que reis como verbo
3721360	3723360	¿sí?
3725360	3727360	nr lo mejor que es adjetivo
3727360	3729360	no que es nr
3735360	3737360	que después venga
3737360	3739360	un adverbio
3739360	3741360	después de un verbo
3741360	3743360	venga un adverbio es mucho menos probable
3743360	3745360	que venga después de un nombre
3747360	3749360	es el doble probable
3749360	3751360	entonces yo tengo que combinar esa probabilidad
3751360	3753360	para ver cuál es la mejor que me da para la secuencia
3753360	3755360	lo que decíamos al principio, yo tengo que tener en cuenta toda la secuencia
3763360	3765360	y entonces acá nos da que esto es mucho más probable
3765360	3767360	que reis, según esta cuenta
3767360	3769360	sea un
3769360	3771360	verbo
3771360	3773360	y en bocán, en este caso le pegamos
3773360	3775360	me dio mucho más probable
3775360	3777360	fíjense
3777360	3779360	sobre todo por esto
3779360	3781360	por el peso de esto
3785360	3787360	un problema que tenemos con esto cuál es
3787360	3789360	o sea resolvimos uno de los problemas
3791360	3793360	que es
3793360	3795360	que desde el punto de vista de las cuentas
3795360	3797360	digamos ¿no? del conteo
3797360	3799360	resolvimos uno de los problemas
3799360	3801360	cómo estimar a partir del conteo
3801360	3803360	lo que no resolvimos acá
3803360	3805360	es que ¿qué pasa con la explosión
3805360	3807360	de combinaciones?
3807360	3809360	porque acá solo teníamos dos combinaciones posibles
3809360	3811360	pero si yo acá hubiera tenido varios candidatos
3811360	3813360	en cada palabra
3813360	3815360	tenía que probar todas las combinaciones posibles
3815360	3817360	entre ellas
3817360	3819360	¿de acuerdo? si acá
3819360	3821360	yo hubiera tenido que calcular
3821360	3823360	si hubiera más de un candidato acá
3823360	3825360	se abre la lista
3825360	3827360	exponencialmente ¿no?
3827360	3829360	¿tiene?
3829360	3831360	entonces ese problema no lo hemos resuelto
3833360	3835360	pero si ustedes se fijan
3835360	3837360	lo que parece un problema muy difícil
3837360	3839360	no lo es tanto
3839360	3841360	porque las mismas restricciones que pusimos nos permite
3841360	3843360	facilitar la cosa
3843360	3845360	porque nosotros como sabemos que cada palabra
3845360	3847360	solo depende del anterior
3849360	3851360	el mejor camino hasta acá
3853360	3855360	digamos el mejor camino total
3855360	3857360	que va a estar compuesto por caminos más cortos
3857360	3859360	óptimos
3859360	3861360	porque
3861360	3863360	para llegar acá solo tengo que saber
3863360	3865360	el mejor hasta acá y la transición
3865360	3867360	¿se entiende?
3867360	3869360	porque si hubiera uno mejor
3869360	3871360	ya lo hubiera procesado antes
3873360	3875360	¿se acuerdan alguna cosa que ya hemos hecho
3875360	3877360	parecida a esa?
3877360	3879360	la distancia de edición
3879360	3881360	lo que vamos a usar es una agorimoprogramación dinámica
3881360	3883360	para resolver este tema
3883360	3885360	el tema de que yo puedo tener muchas combinaciones
3885360	3887360	pero que yo solo llego hasta cierto lugar
3887360	3889360	¿por qué?
3889360	3891360	porque yo tengo mi hipótesis marcoviana que dice
3891360	3893360	mi futuro solo depende de este estado en el que estoy
3895360	3897360	¿de acuerdo?
3897360	3899360	entonces
3903360	3905360	vamos a primero a caracterizar
3905360	3907360	el modelo general
3907360	3909360	de hidden mark on models
3909360	3911360	porque esto se utiliza para muchas cosas
3911360	3913360	pero el hidden mark on model es como una extensión
3913360	3915360	de un automata finito
3915360	3917360	donde yo le voy a asignar probabilidades
3921360	3923360	voy a tener estados
3927360	3929360	voy a tener probabilidades de transición
3941360	3943360	¿si?
3945360	3947360	y
3947360	3949360	observaciones
3951360	3953360	asociadas a cada estado
3955360	3957360	perdón
3963360	3965360	pasa que le puse n a las observaciones
3965360	3967360	y no está bien
3971360	3973360	voy a tener un conjunto de observaciones
3973360	3975360	y voy a tener la probabilidad de emitir
3987360	3989360	para cada
3989360	3991360	observación posible
3991360	3993360	la probabilidad de emitirla en cierto estado dado
3995360	3997360	¿de acuerdo?
4001360	4003360	no
4003360	4005360	perdón
4005360	4007360	dije mal
4007360	4009360	la probabilidad de emisión
4009360	4011360	depende de las observaciones posibles
4011360	4013360	no del estado en el que estamos
4013360	4015360	es independiente del estado
4015360	4017360	¿si?
4017360	4019360	no, está bien
4019360	4021360	depende del estado
4021360	4023360	para cada observación
4023360	4025360	yo voy a tener de 0 1
4025360	4027360	de 0 2 de 0 3
4027360	4029360	perdón de 1 2 3 la posibilidad de emitir
4029360	4031360	lo vamos a ver bien
4031360	4033360	y estados finales
4033360	4035360	iniciales y finales
4039360	4041360	entonces
4041360	4043360	vamos a...
4043360	4045360	voy a bajar otra cosa
4047360	4049360	esto es en general
4049360	4051360	lo que es un modelo de marco
4051360	4053360	yo tengo un conjunto de estados ocultos
4053360	4055360	que no sé dónde están
4055360	4057360	y tengo observaciones
4057360	4059360	que ocurren en cada estado
4059360	4061360	yo en cada estado emito algo
4061360	4063360	si lo vemos
4063360	4065360	desde el punto de vista del postal
4065360	4067360	nuestros estados ocultos que son
4067360	4069360	son los postals
4069360	4071360	las posibles
4071360	4073360	etiquetas gramaticales
4073360	4075360	y lo que emitimos
4075360	4077360	es la palabra
4077360	4079360	y este a de 0 1 y a 0 2
4079360	4081360	es la probabilidad de transición entre estados
4081360	4083360	ya que todo de sumar 1
4083360	4085360	¿de acuerdo?
4085360	4087360	si yo lo veo
4087360	4089360	desde el punto de vista de
4089360	4091360	esto lo estoy sacando
4091360	4093360	estas tramparecias
4093360	4095360	la estoy sacando de un curso que dio
4095360	4097360	un profesor
4097360	4099360	de Oregón
4099360	4101360	que se llama Brian Rohr
4101360	4103360	que vino a dar un curso acá
4103360	4105360	y me quedé con las presentaciones
4105360	4107360	de esto porque me parece que estaba muy clara
4109360	4111360	yo tengo una secuencia de palabras
4111360	4113360	si
4113360	4115360	en tiempos unos n
4115360	4117360	primera, segunda, tercera
4117360	4119360	que discretizamos el tiempo
4119360	4121360	vocabulario
4121360	4123360	y los tags
4123360	4125360	y yo digo bueno
4131360	4133360	la probabilidad de emitir
4137360	4139360	la palabra tal
4139360	4141360	va a depender solamente
4141360	4143360	del tag que ya estaba
4143360	4145360	solo depende del tag J
4145360	4147360	si en el momento J
4147360	4149360	va a depender del tag que tengo en la posición J
4151360	4153360	J acá es la posición
4153360	4155360	y es la palabra
4159360	4161360	y las probabilidades de transición van a ser
4161360	4163360	la probabilidad de pasar de un tag al otro
4165360	4167360	¿de acuerdo?
4167360	4169360	y al principio tengo unas ciertas probabilidades
4169360	4171360	que son
4171360	4173360	la probabilidad de arrancar con un tag
4173360	4175360	es la distribución inicial
4175360	4177360	la probabilidad de arrancar
4177360	4179360	con un tag
4179360	4181360	y la probabilidad de terminar
4183360	4185360	con un tag
4185360	4187360	que son las que necesito para completar
4187360	4189360	para que me quede consistente
4189360	4191360	al principio tengo que establecer una distribución
4191360	4193360	de probabilidad entre las que comienzan
4193360	4195360	yo para eso meto un tag adicional
4195360	4197360	y acá son los conteos simplemente
4199360	4201360	acá lo que hicimos fue
4201360	4203360	suavizarlo con la técnica Laplace
4205360	4207360	y esta forma
4207360	4209360	una toda complicada es
4213360	4215360	la probabilidad en el tiempo
4215360	4217360	T estar en el estado J
4219360	4221360	habiendo visto toda la secuencia
4221360	4223360	que tuve hasta el momento
4223360	4225360	es decir yo voy avanzando
4225360	4227360	por mi secuencia de palabra ahora voy a mover un ejemplo
4227360	4229360	y el alfa
4229360	4231360	me dice
4231360	4233360	la probabilidad de que
4233360	4235360	al principio estoy en uno ¿no? la probabilidad que estar en el principio es uno
4237360	4239360	en el tiempo T es
4239360	4241360	el alfa
4241360	4243360	de T-1
4243360	4245360	el tiempo anterior
4245360	4247360	por la probabilidad de transición
4247360	4249360	por la probabilidad de emitir
4249360	4251360	y me quedo con el máximo
4251360	4253360	de todos esos
4253360	4255360	mi mejor probabilidad
4255360	4257360	es el máximo de todos esos
4257360	4259360	la más probable es eso
4259360	4261360	y como ven en cada paso
4261360	4263360	T yo solo dependo del alfa anterior
4265360	4267360	la mejor secuencia
4269360	4271360	en el tiempo T
4271360	4273360	va a estar formado por la mejor secuencia
4273360	4275360	del tiempo T-1
4275360	4277360	si
4277360	4279360	mejor dicho
4279360	4281360	va a estar formado por
4281360	4283360	lo que me maximice la mejor secuencia
4283360	4285360	de T-1 multiplicada por la emisión
4287360	4289360	yo voy a tener una mejor secuencia
4289360	4291360	para el TAG 1, 2, 3 y 4
4291360	4293360	yo para los 4 hago la cuenta
4293360	4295360	digo bueno
4295360	4297360	la mejor secuencia para que estuviera
4297360	4299360	en un adjetivo
4299360	4301360	en la posición T-1
4301360	4303360	era tal
4303360	4305360	un nombre
4305360	4307360	mi mejor secuencia es la que más inmice
4307360	4309360	la mejor secuencia para el TAG T-1
4309360	4311360	adjetivo multiplicada por la transición
4311360	4313360	de un adjetivo, un nombre
4313360	4315360	multiplicada por la probabilidad de emitir
4315360	4317360	y eso lo hago para todos los TAG anteriores posibles
4317360	4319360	y me quedo con el mejor
4319360	4321360	ahora lo voy a mover en un ejemplo
4321360	4323360	pero le des esa
4323360	4325360	y además guardo cuál fue el estado del que vine
4325360	4327360	para saber cuál es la secuencia
4327360	4329360	yo todo eso lo puedo resolver
4329360	4331360	como yo dependo solo
4331360	4333360	de la posición en la que estoy
4335360	4337360	puedo resolverlo con una tablita
4337360	4339360	y eso es lo que voy a hacer
4339360	4341360	hacer lo que se llama un trellis, una tabla
4341360	4343360	donde yo voy guardando esas probabilidades
4345360	4347360	supongamos que nosotros
4347360	4349360	tenemos este ejemplo
4349360	4351360	que
4351360	4353360	fruit flies fast
4355360	4357360	quiere decir
4357360	4359360	las frutas vuelan rápido
4359360	4361360	las
4363360	4365360	fast
4367360	4369360	no pero es este
4371360	4373360	es una gente
4375360	4377360	esto se puede leer como la fruta
4377360	4379360	frut flies fast
4383360	4385360	ahi va
4385360	4387360	claro
4387360	4389360	es la que buscamos
4393360	4395360	vamos a ver si nos va
4395360	4397360	pero si se fijan
4397360	4399360	fruit no es ambigua
4399360	4401360	pero flies si
4401360	4403360	puede ser las
4403360	4405360	las moscas o el verbo volar
4405360	4407360	y fast es este verbo
4407360	4409360	que es eso
4409360	4411360	de ayunar
4411360	4413360	un adverbio
4413360	4415360	o un adjetivo
4415360	4417360	si
4417360	4419360	entonces yo voy a tener que calcular
4419360	4421360	todas las combinaciones posibles
4421360	4423360	que son 3 por 2
4423360	4425360	6 posibles
4427360	4429360	y acá tengo la probabilidad
4429360	4431360	de transición entre tags
4431360	4433360	no acá lo que estoy diciendo es
4433360	4435360	la probabilidad
4437360	4439360	de que un adjetivo
4439360	4441360	venga despues de otro adjetivo
4441360	4443360	es 0 1
4445360	4447360	todo esto lo hice contando en el corpus
4447360	4449360	se entiende
4449360	4451360	conté todas las veces que en el corpus
4451360	4453360	un adjetivo y otro adjetivo
4453360	4455360	la probabilidad de que despues
4455360	4457360	de un adjetivo venga
4457360	4459360	siempre tengo que mirar la jota
4459360	4461360	venga un nombre es 0 3
4461360	4463360	y asi
4463360	4465360	acá lo que estamos diciendo es imposible
4465360	4467360	que despues de un verbo verga otro verbo
4469360	4471360	por supuesto esto no
4471360	4473360	acá solo tengo la tabla
4473360	4475360	que son todos los que me interesan a mi
4475360	4477360	pero esto seria una tabla
4477360	4479360	fiquese que no es tan grande esta tabla
4479360	4481360	son todas las combinaciones
4481360	4483360	es n por n donde n son mis tags posibles
4485360	4487360	y despues tengo la probabilidad de emisión
4489360	4491360	la probabilidad de emitir
4491360	4493360	frut
4493360	4495360	en el tag 2
4495360	4497360	se acuerda de lo que la duda de si tenian si el estado es
4497360	4499360	dado que es un nombre
4499360	4501360	la probabilidad que sea fruta es 0 1
4501360	4503360	por supuesto que esta probabilidad es un juguete
4503360	4505360	lo que estoy diciendo de una de cada 10 veces
4505360	4507360	que aparece un sustantivo en el corpus es fruto
4509360	4511360	que a mi de acá
4511360	4513360	nosotros vamos a dejar su probabilidad muy pequeña
4513360	4515360	y por eso usualmente lo que hacemos en la realidad
4515360	4517360	es sumarlo a ritmo
4517360	4519360	multiplicar porque si no tenemos problemas
4519360	4521360	de underflow o horribles
4523360	4525360	bueno y asi
4525360	4527360	la probabilidad de emitir para cada una de ellas
4527360	4529360	con las posibles categorias
4529360	4531360	es 1
4533360	4535360	entonces
4537360	4539360	lo que yo quiero saber es cuál es la probabilidad
4539360	4541360	de cada oración
4541360	4543360	de cada secuencia
4543360	4545360	digamos
4545360	4547360	mejor dicho
4547360	4549360	en
4551360	4553360	para viterbi
4553360	4555360	nosotros tenemos tres grandes problemas
4555360	4557360	a resolver
4557360	4559360	hay tres problemas fundamentales
4559360	4561360	en los modelos de los hedemarco model
4561360	4563360	que es
4563360	4565360	dado a un hedemarco model este modelo que tenemos acá
4565360	4567360	yo ya con estas
4567360	4569360	transiciones tengo
4569360	4571360	el modelo no tengo los tags
4571360	4573360	que son los de tag oculto
4573360	4575360	las palabras
4575360	4577360	la probabilidad de transición y la probabilidad de emisión
4577360	4579360	en el estado inicial en el final
4579360	4581360	tengo un modelo de marcó
4581360	4583360	cuál es mi problema bueno uno de los problemas es
4583360	4585360	calcular la verosimilitud es decir dado un hedemarco model
4585360	4587360	y una secuencia
4587360	4589360	o de palabras quiero calcular la probabilidad
4591360	4593360	esto es ni más ni menos un modelo de lenguaje
4595360	4597360	otra tarea es la de decodificar
4597360	4599360	que es
4599360	4601360	dado un hedemarco model y una secuencia
4601360	4603360	calcular la mejor secuencia de estado oculto
4603360	4605360	en el parto hospital lo que hacemos
4605360	4607360	es esto decodificar
4607360	4609360	y hay otra tercera tarea
4609360	4611360	que es la de aprender
4611360	4613360	que es
4613360	4615360	aprender las probabilidades de transición a partir
4615360	4617360	de texto arbitrario
4617360	4619360	que es algo que en esta clase
4619360	4621360	en este curso no lo vemos
4623360	4625360	entonces yo voy a tratar de resolverla
4625360	4627360	segunda tarea
4629360	4631360	no, ¿quiere que tiene que ser yo?
4639360	4641360	muy difícil esto
4641360	4643360	bueno
4643360	4645360	entonces nosotros hemos tratado de resolver la segunda tarea
4645360	4647360	la tarea es de decodificar, asignarla a mejor secuencia
4651360	4653360	entonces arrancamos con una tablita así
4653360	4655360	que dice bueno
4655360	4657360	acá yo tengo la posible categoría
4661360	4663360	y acá tengo las posibles palabras
4663360	4665360	fíjense que ahí
4665360	4667360	uno es fruit
4667360	4669360	flies
4669360	4671360	fast
4671360	4673360	¿tá?
4677360	4679360	al principio y hay bueno tenemos la categoría
4679360	4681360	cero que es el tag de comienzo de la eración
4681360	4683360	¿tá?
4683360	4685360	al principio de mi algoritmo
4687360	4689360	la probabilidad es uno de estar en el estado cero
4691360	4693360	el estado cero es el
4693360	4695360	s ¿no?
4695360	4697360	¿de acuerdo?
4697360	4699360	no, no dije nada
4699360	4701360	la probabilidad es uno acá
4701360	4703360	y no puede estar nunca
4703360	4705360	en el estado cero
4705360	4707360	al lado a la 3
4707360	4709360	en la 4 lo voy a reutilizar
4709360	4711360	el cero para el final
4711360	4713360	por eso no lo puse acá
4713360	4715360	eso es lo que sabemos, que al principio necesariamente
4715360	4717360	esto toca
4717360	4719360	¿tá?
4719360	4721360	luego
