start	end	text
1709360	1711360	tiene que haber un ser humano que diga,
1711360	1713360	esto vale tanto,
1713360	1716360	me parece muy interesante,
1716360	1720360	y que hace tiempo que vengo proponiendo sin éxito,
1720360	1723360	una tesis anotada al respecto,
1723360	1725360	sin éxito porque no tengo alumno,
1725360	1732360	este es todos los procesos que nosotros conocemos de evaluación,
1732360	1735360	asumen que el estándar es fijo,
1735360	1742360	es decir, que hay una verdadera categoría para esta palabra,
1743360	1750360	que acá yo puedo equivocarme en ponerle nombre a gato,
1750360	1754360	pero que de última sé lo que el algoritmo tiene que darme,
1754360	1757360	ahora hay casos donde eso no es tan claro,
1757360	1760360	porque, por ejemplo, si yo tengo un tuit
1760360	1765360	y quiero decir si es gracioso o no,
1765360	1767360	es una opinión subjetiva,
1767360	1770360	entonces, yo puedo hacer un corpus,
1770360	1772360	donde diga, bueno,
1772360	1775360	la mayoría de las personas dijeron que era gracioso,
1775360	1777360	entonces, por lo tanto, lo declaro como gracioso,
1777360	1780360	y un algoritmo que dice que no es gracioso se equivoca,
1780360	1782360	o en realidad, de alguna forma,
1782360	1786360	tendría que incorporar en el corpus esa distribución,
1786360	1789360	eso no he visto que esté hecho,
1789360	1791360	para mí hay un campo de investigación ahí,
1791360	1793360	perdón, me debió un poco,
1793360	1798360	cuestión que teníamos, ya no sé qué estaba hablando,
1798360	1800360	ah, las categorías del corpus gran,
1800360	1802360	y esto es nuevo,
1802360	1805360	esto es nuevo, lo agregué para este año,
1805360	1807360	porque me pareció muy interesante,
1807360	1811360	hay un proyecto que se llama Dependencias Universales,
1811360	1813360	que es ese que hoy les mostré allá encima,
1813360	1815360	en el tema del laboratorio,
1815360	1818360	que lo que trata de hacer es tener un formato consistente
1818360	1820360	para anotación de tribancas,
1820360	1822360	los tribancas son cosas que tienen anotados
1822360	1824360	los partos hospitales y más cosas,
1824360	1827360	información sintáctica y tal,
1827360	1831360	pero lo que busca es tener una forma de anotar
1831360	1834360	que sea universal, que pueda atravesar los idiomas,
1834360	1836360	con todo lo que tengan en común,
1836360	1839360	y dejando las especificidades de cada idioma
1839360	1842360	para el costado, digamos, en un campo específico,
1842360	1843360	¿de acuerdo?
1843360	1845360	Este proyecto está avanzando mucho,
1845360	1847360	está basado en las dependencias
1847360	1849360	que se definieron en Stanford
1849360	1851360	y una propuesta de postage universal
1851360	1853360	que Google había hecho en un momento,
1853360	1856360	pero es un proyecto de colaboración abierta,
1856360	1859360	porque hay gente muy pesada, digamos,
1859360	1864360	que ha trabajado mucho en el parcing de dependencias,
1864360	1866360	yo creo que va a andar bien
1866360	1868360	y por eso les estamos pidiendo que transformen
1868360	1870360	eso en el formato este.
1872360	1875360	En los postage tienen ciertas etiquetas universales de postage,
1875360	1877360	son muy sencillas, son muy poquitas,
1877360	1881360	fíjense que tiene una posición muy conservadora,
1881360	1883360	no se pone muy...
1884360	1886360	Esto va a abrir el...
1889360	1892360	Ven, acá tienen unas poquitas categorías,
1892360	1895360	clases abiertas, ¿acuerdan lo que era clases abiertas
1895360	1897360	y cerradas de palabras no abiertas?
1897360	1900360	Son las que admiten nuevos elementos
1900360	1903360	y las cerradas son como las preposiciones,
1903360	1905360	por ejemplo, que son fijas.
1907360	1909360	O sea, tratan de humildemente
1909360	1912360	poner una notación muy básica,
1914360	1918360	pero que pueda servir para generar intercambio
1918360	1921360	entre diferentes investigadores, digamos.
1924360	1926360	Y luego tienen otras características
1926360	1928360	que son características universales,
1928360	1931360	como género, número, forma verbal
1931360	1934360	y algunas específicas para algunos idiomas
1934360	1936360	que solo aparecen en algunos idiomas.
1937360	1941360	Fenómenos lingüísticos que no se enganen en todos los idiomas.
1941360	1946360	Bueno, para realizar este análisis eléxico,
1946360	1949360	nosotros tenemos dos categorías principales.
1949360	1952360	Una es, como casi todas estas cosas que hemos estado hablando,
1952360	1954360	una es un enfoque por relas,
1956360	1959360	que es la aproximación más clásica,
1959360	1962360	que es, bueno, esto que decíamos hoy,
1962360	1964360	después de alguien se pone a estudiar
1964360	1967360	y dice, bueno, si aparece T banco,
1968360	1971360	entonces banco, toda la palabra banco
1971360	1973360	que aparezca después de T
1973360	1976360	es un verbo, regla número 1.
1985360	1987360	Se robó un banco.
1991360	1993360	Este banco aparece después de un,
1993360	1996360	entonces yo lo voy a notar como un nombre.
1998360	1999360	Sí.
2002360	2007360	Pero acá yo digo no banco a
2007360	2008360	Juan.
2010360	2015360	Y acá no banco a,
2015360	2017360	a mí me gusta más el contexto de la derecha.
2017360	2021360	Bueno, todo esto y casos más complicados pueden haber.
2021360	2023360	Por supuesto, si uno se pone a mirar los corpos,
2023360	2025360	entonces lo que hace es
2026360	2029360	empieza a mirar todas las posibilidades que hay,
2029360	2031360	trabaja durante años
2031360	2033360	y genera una lista de reglas
2033360	2035360	para este,
2036360	2037360	desamiguar.
2037360	2038360	Es el enfoque tradicional,
2038360	2040360	es muy, muy costoso,
2040360	2042360	porque necesito lingüistas estudiando,
2044360	2045360	pero este aquí,
2045360	2047360	que este tipo de métodos
2050360	2052360	funciona muy bien en esta tarea
2052360	2054360	y por acá
2056360	2060360	no lo tengo notado a,
2060360	2061360	pero hay un,
2061360	2062360	un, un tagger en inglés
2062360	2064360	que utiliza este tipo métodos,
2064360	2065360	ahora lo vamos a ver
2065360	2068360	y que llega a un 99,5% de accuracy.
2068360	2070360	Es decir, que etiqueta muy bien.
2070360	2072360	Es una tarea que con mucho trabajo
2072360	2073360	y muchas reglas
2073360	2075360	se puede resolver así.
2078360	2079360	La otra aproximación,
2079360	2081360	ahora vamos a dar los detalles,
2081360	2082360	pero la otra aproximación
2082360	2084360	es el enfoque estadístico.
2084360	2086360	Bueno, a partir de los grandes corpos
2086360	2087360	que tenemos,
2088360	2089360	grandes entre comillas,
2089360	2090360	son corpos anotados,
2090360	2091360	no es que tenemos
2091360	2093360	miles de millones de palabras, no?
2096360	2098360	Entreno modelos a partir de grandes,
2098360	2099360	grandes corpos.
2102360	2104360	Y estimó la probabilidad
2104360	2105360	de la palabra,
2105360	2107360	de la categoría según el contexto.
2107360	2109360	Y también hay enfoques híbridos
2109360	2111360	que son, por ejemplo,
2111360	2112360	el tagger de Bril,
2112360	2114360	que lo vamos a ver un poquito después.
2117360	2118360	Como acá hemos
2118360	2120360	virado para lo estadístico,
2120360	2122360	veí rápidamente por el tema de los derrelas,
2122360	2124360	pero esencialmente en los años 60
2124360	2126360	el análisis léxico se empieza haciendo así,
2129360	2130360	una arquitectura de dos capas.
2130360	2132360	Le asignó categorías potenciales
2132360	2133360	a partir de un diccionario.
2133360	2134360	Es decir, qué cosas puede tener.
2134360	2135360	Esto es lo primero que toca hacer.
2135360	2137360	Era lo que hablamos al principio de la clase, no?
2137360	2139360	Banco puede ser o un verbo o un nombre.
2139360	2141360	No puede ser una preposición.
2142360	2144360	Porque no está en la lista de preposición.
2144360	2146360	Si fuera bajo, sí.
2146360	2148360	Y el acabado se utiliza reglas
2148360	2150360	de desambiguación
2150360	2151360	para eliminar categorías.
2151360	2153360	Es lo que nos imaginaríamos,
2153360	2155360	que haríamos de análisis, no?
2157360	2158360	Por ejemplo,
2160360	2162360	en Siji Tiger,
2163360	2164360	que hace una cosa así,
2167360	2169360	para cada palabra,
2170360	2172360	le asignan partos pitch y alguna cosa adicional.
2176360	2177360	No, miento.
2177360	2179360	Esto es el lexicón.
2180360	2182360	Tiene 56.000 palabras,
2183360	2185360	con morfología a dos niveles,
2185360	2188360	como vimos en la clase de morfología,
2190360	2193360	con un postag y además
2193360	2196360	con ciertas características lingüísticas.
2200360	2201360	Por ejemplo,
2201360	2203360	all es un determinante,
2203360	2205360	pero además es un cuantificador.
2205360	2208360	Algo que es un predeterminador,
2208360	2210360	que yo no sé lo que es, etcétera, no?
2212360	2214360	Reglas hechas a mano.
2214360	2215360	Esto está hecho a mano.
2216360	2217360	Entonces,
2219360	2221360	yo tengo la grabación Pablo,
2221360	2223360	John Dutt, Salivation,
2223360	2225360	y tengo todas las categorías posibles.
2225360	2227360	Tengo Pablo,
2227360	2229360	que es un hombre singular propio,
2229360	2230360	Jav,
2230360	2232360	que tiene dos posibilidades.
2234360	2235360	Jav, perdón.
2236360	2237360	John, Dutt,
2237360	2238360	y Dutt, que tiene cuatro.
2239360	2240360	Dutt es complicado.
2240360	2241360	Dutt es qué?
2242360	2243360	Tiene cuatro candidaturas, no?
2243360	2245360	Entonces, yo tengo que desambiguar
2247360	2249360	en esta oración lo que pasa.
2249360	2250360	¿Y cómo desambigúo?
2250360	2251360	Uo.
2251360	2252360	Diguo.
2253360	2254360	Con reglas.
2254360	2258360	3.744 reglas para quitar las etiquetas incorrectas.
2258360	2260360	Un laburo de la hostia, no?
2260360	2261360	Porque digamos,
2261360	2263360	cada regla puede romper otra, además, no?
2263360	2265360	Porque la regla es lo que dice,
2265360	2267360	bueno, Dutt, que tengo Dutt,
2267360	2269360	si la siguiente palabra es un adjetivo,
2269360	2271360	un adverbio, un cuantificador,
2276360	2279360	elimino los que no sean adverbios.
2279360	2281360	O sea, lo estoy calificando como adverbio.
2281360	2284360	O, y además, no, perdón,
2284360	2286360	si la siguiente palabra y la demás
2286360	2288360	aparecen al final de una oración,
2289360	2291360	y la palabra siguiente no es un,
2291360	2293360	anterior no es un verbo,
2293360	2296360	como consider que permite adjetivo.
2298360	2301360	Esto es un lenguaje para especificar este tipo de reglas.
2301360	2303360	Entonces, eliminarlo y dejarlo como adverbio.
2304360	2305360	¿Se entiende?
2306360	2307360	Son reglas.
2307360	2309360	Mucho trabajo, pero con buenos resultados.
2310360	2312360	Generalmente, lo que sucede con los métodos de regla,
2312360	2314360	lo que han demostrado los métodos de regla,
2314360	2315360	es que vos,
2317360	2319360	tu accuracy, que es la,
2319360	2321360	se acuerdan, no sé si lo hablamos,
2321360	2323360	pero la accuracy es la capacidad de clasificar bien
2323360	2325360	en un problema de clasificación,
2325360	2327360	de si en que hay, cuántas clasifico bien.
2328360	2330360	La accuracy va creciendo,
2332360	2334360	con el método va mejorando,
2334360	2336360	pero sigan a un techo.
2337360	2340360	Crece rápidamente, pero crea un techo.
2340360	2342360	Los métodos de aprendizaje automático general,
2342360	2344360	o general no,
2344360	2346360	pueden crecer más despacio,
2346360	2350360	pero tienen más alto el, el, el techo.
2352360	2353360	Sí, y lo que ha pasado últimamente,
2353360	2356360	es que las redes neuronales son un poquito más altos.
2357360	2359360	Entonces, estos pasaron los últimos cinco años,
2359360	2360360	últimos cinco.
2360360	2365360	Yo, yo vi,
2365360	2366360	una de las señales de que,
2366360	2367360	de que esto progresa,
2367360	2368360	o de que yo estoy viejo,
2368360	2369360	una de las dos,
2369360	2371360	es que yo vi este fenómeno,
2371360	2373360	los métodos que estaban por regla,
2373360	2375360	cómo los métodos de aprendizaje automáticos,
2375360	2378360	tomaron el estado del arte en diferentes tareas,
2378360	2380360	y ahora estamos viendo
2380360	2383360	cómo los métodos del redes neuronales
2383360	2385360	de deep learning están superando los.
2385360	2387360	Es más,
2387360	2388360	recuerdo que,
2388360	2390360	cuando se hacía el chiste de bueno,
2390360	2391360	a ver,
2391360	2393360	vamos a, vamos a hacer que las conferencias
2393360	2394360	dejen de ser,
2394360	2396360	miren este, miren esta tarea
2396360	2397360	que antes se resolvía con regla,
2397360	2399360	cómo la resolvo con aprendizaje automático,
2399360	2401360	y, y me mejoró.
2401360	2402360	Y ahora el chiste,
2402360	2403360	bueno, vamos a dejar de,
2403360	2405360	ah, miren esta tarea que antes la resolvía bien
2405360	2406360	con aprendizaje automático,
2406360	2407360	la resolvo con deep learning,
2407360	2408360	y también mejoró,
2408360	2410360	aplicando los mismos métodos.
2410360	2412360	Estamos viviendo este momento.
2414360	2415360	Pero,
2415360	2416360	esencialmente,
2416360	2418360	la información de base
2418360	2420360	de la que se prende la misma.
2420360	2421360	Bueno,
2421360	2422360	la otra alternativa,
2422360	2423360	¿Cómo estamos ahora?
2423360	2424360	¿Qué hora es?
2424360	2426360	No hay cinco.
2426360	2427360	No hay cinco,
2427360	2428360	está muy bien.
2428360	2430360	La otra alternativa,
2430360	2432360	es,
2432360	2434360	hacer part hospital
2434360	2436360	con un modelo de clasificación secuencial.
2436360	2438360	¿Tá?
2438360	2440360	El modelo de clasificación secuencial
2440360	2442360	en el que vamos a poner énfasis,
2442360	2444360	y que vamos a presentar acá,
2444360	2446360	los Hiedemarco Models.
2446360	2447360	¿Tá?
2449360	2451360	Hoy en día,
2454360	2455360	los Hiedemarco Models
2455360	2457360	no son el método más
2457360	2459360	utilizado
2459360	2462360	para las tareas de clasificación secuencial.
2463360	2465360	Los Hiedemarco Models
2467360	2469360	nacieron en los años 60,
2470360	2472360	tomaron fuerza en los años 90,
2472360	2474360	son un modelo de clasificación secuencial.
2474360	2476360	En la primera década del siglo XXI,
2476360	2478360	fueron sustituidos,
2478360	2480360	estoy hablando en general,
2480360	2482360	por métodos
2482360	2484360	que se basan en otros
2484360	2485360	principios,
2485360	2487360	que son discriminativos y no generativos,
2487360	2489360	capaz que en un par de clases lo vemos,
2489360	2491360	y ahora están
2491360	2493360	de moda las redes neuronales,
2493360	2495360	pero me parece que son muy interesantes,
2495360	2497360	porque muestra,
2497360	2499360	permiten ver el problema
2499360	2501360	que estamos resolviendo,
2501360	2503360	y una forma de aproximarse a él.
2503360	2505360	Y realmente funciona bastante bien,
2505360	2507360	digamos, además, ¿no?
2508360	2510360	Entonces, por eso,
2510360	2511360	me parece que es muy interesante,
2511360	2513360	ah, y además se aplican a una cantidad de problemas.
2513360	2515360	Son un modelo.
2515360	2517360	En particular,
2517360	2519360	los otros los hemos ver aplicados al Parto Hospital.
2521360	2523360	Entonces,
2523360	2525360	los modelos de Marco, de estados ocultos,
2525360	2527360	son un caso particular
2527360	2529360	de la inferencia vallesiana, de la inferencia que vimos,
2529360	2531360	se acuerdan cuando hablamos de la clasificación de errores,
2531360	2533360	que vimos de cómo clasificar una palabra,
2533360	2535360	cómo buscar la candidata
2535360	2537360	y la regla de valles y demás.
2537360	2539360	Bueno, esto es,
2539360	2541360	los modelos de Marco, de estados ocultos,
2541360	2543360	son como una versión
2543360	2545360	secuencial
2545360	2547360	donde aplicamos la regla de valles.
2550360	2552360	Lo que decíamos hoy,
2552360	2555360	el post-haggin se puede ver como una tarea de clasificación de secuencias,
2555360	2557360	dado una secuencia de palabra,
2557360	2559360	una secuencia apropiada de categorías gramaticales.
2559360	2561360	Para toda la secuencia.
2561360	2563360	No solo para cada palabra.
2563360	2565360	No es que yo clasifico la primera, la segunda,
2565360	2567360	sino clasifico toda a la vez.
2567360	2569360	Eso es un problema de clasificación secuencial.
2569360	2571360	Un problema de clasificaciones,
2571360	2573360	dado una observación, se intenta terminar
2573360	2575360	a cuál conjunto de clases pertenece.
2575360	2577360	No.
2577360	2579360	¿A cuál clase de un conjunto pertenece?
2579360	2581360	¿Tá?
2581360	2583360	Un problema de clasificaciones,
2583360	2585360	es un problema de que tengo un conjunto discreto de valores
2585360	2587360	y un objeto a la que le quiero asignar una categoría.
2587360	2589360	Eso se llama clasificación.
2595360	2597360	¿De acuerdo?
2599360	2601360	Si yo aquí veo un animal
2601360	2603360	y me dan la cantidad de patas que tiene
2603360	2605360	o la foto
2605360	2607360	si quieren hacer lo más complicado,
2607360	2609360	yo tengo que decidir si es un perro, un gato,
2609360	2611360	un camecho, un león.
2611360	2613360	Eso es un problema de clasificación.
2614360	2616360	Si yo quiero saber cuánto me puede ese animal,
2616360	2619360	cuánto lo puedo llegar a vender en el mercado libre,
2619360	2621360	eso es un problema de regresión,
2621360	2623360	porque lo estoy asignando una,
2623360	2625360	un valor real, la veo contigo.
2625360	2627360	¿De acuerdo?
2627360	2629360	Acá, en el negocio, en el pensamiento y en el juego natural,
2629360	2631360	típicamente se habla de problemas de clasificación.
2631360	2633360	Nosotros hemos visto una cantidad de problemas ya de clasificación.
2633360	2635360	Por ejemplo, el primero que vimos
2635360	2637360	fue el de la separación de oraciones,
2637360	2639360	que esencialmente consiste en clasificar
2639360	2641360	cada punto en punto final
2641360	2643360	o otra cosa.
2649360	2651360	Por ejemplo,
2651360	2653360	voy a usar este ejemplo del libro,
2653360	2655360	cada año me propongo
2655360	2657360	hacer la versión español, pero nunca...
2659360	2661360	Yo tengo este ejemplo, ¿no?
2667360	2669360	Secretariat
2669360	2671360	que es un caballo.
2673360	2675360	Se espera que corra mañana.
2677360	2679360	Y yo tengo que asignarle
2679360	2681360	su parto espiritual.
2681360	2683360	¿Verdad?
2683360	2685360	Una nueva versión simplificada,
2685360	2687360	tenemos las categorías que son poquitas
2687360	2689360	y solo los post-arts.
2691360	2693360	La idea cuál es,
2693360	2695360	bueno, de todas las posibles
2695360	2697360	secuencias de etiqueta que tengo,
2699360	2701360	dijo la secuencia de etiqueta que es la más probable
2701360	2703360	para la secuencia de observación
2703360	2705360	de las n palabras.
2705360	2707360	¿De acuerdo?
2709360	2711360	¿Cómo puedo hacer eso yo pensando
2711360	2713360	lo de pensando como en la clase pasada?
2715360	2717360	¿Cómo podría llegar a hacer eso yo?
2725360	2727360	¿Cómo se le ocurre que pueda hacer eso?
2729360	2731360	¿Cómo?
2735360	2737360	Contando, ¿no?
2737360	2739360	Cuento todas las veces que apareció de una forma
2739360	2741360	y cual todas las veces que apareció
2741360	2743360	de la otra
2743360	2745360	y me quedo con la más común.
2747360	2749360	¿Qué problema tiene eso?
2753360	2755360	No, pero yo digo toda la oración.
2755360	2757360	¿Qué problema tiene eso?
2757360	2759360	Tiene dos problemas.
2759360	2761360	Tirando a imposible, ¿no?
2761360	2763360	Es poco probable que esto haya aparecido
2763360	2765360	ya en el cuerpo antes
2765360	2767360	y se apareció una vez,
2767360	2769360	no suficientemente cantidad de veces
2769360	2771360	que va a pastimar su probabilidad.
2771360	2773360	Problema número 1.
2775360	2777360	Problema número 2, no me acuerdo cuál.
2779360	2781360	Este, me olvidé cuál era la otra
2781360	2783360	característica que iba a mencionar,
2783360	2785360	no importa, ya me voy a acordar.
2785360	2787360	El problema es que no tengo forma
2787360	2789360	de estimar así contando
2793360	2795360	Entonces,
2795360	2797360	pero observemos
2797360	2799360	que lo que nosotros tenemos es una secuencia
2799360	2801360	de palabras.
2803360	2805360	Y queremos saber
2805360	2807360	sus ciertos tags.
2809360	2811360	¿De acuerdo?
2815360	2817360	Esencialmente, en nosotros,
2817360	2819360	lo que queremos es esto.
2819360	2821360	Una estimación
2823360	2825360	de alguna forma
2827360	2829360	de la probabilidad
2829360	2831360	de la secuencia,
2831360	2833360	este 1 a la n
2833360	2835360	dado que tengo las palabras.
2835360	2837360	¿De acuerdo?
2837360	2839360	Esto, si les parece parecido
2839360	2841360	a lo que vimos para la...
2841360	2843360	para el candidato
2843360	2845360	a mejores palabras
2845360	2847360	para la corrección, es porque es lo mismo.
2847360	2849360	Esencialmente, es lo mismo una más consecuencia.
2849360	2851360	Yo tengo una secuencia de palabras
2851360	2853360	y quiero
2853360	2855360	el argumento
2855360	2857360	que maximiza
2857360	2859360	esta probabilidad.
2859360	2861360	¿De acuerdo?
2861360	2863360	Yo quiero
2863360	2865360	no la probabilidad de esto, sino la que maximiza
2865360	2867360	esa probabilidad.
2867360	2869360	Esencialmente acá,
2869360	2871360	en este ejemplo nuestro
2871360	2873360	si se fijan,
2873360	2875360	sólo tengo 2...
2875360	2877360	Ah, ese era el otro problema.
2877360	2879360	Que en este ejemplo, yo sólo tengo 2 posibilidades.
2879360	2881360	Porque estas no son ambigüas,
2881360	2883360	según mi dicionario.
2883360	2885360	La unidad de esa ambigüa es RACE
2885360	2887360	que puede ser un verbo o un nombre.
2889360	2891360	RACE, la carrera
2891360	2893360	y RACE correr.
2893360	2895360	Entonces, yo sólo tengo 2 secuencias.
2895360	2897360	El otro problema que yo les digo hoy es que además
2897360	2899360	la combinación de palabras
2899360	2901360	de categorías explota.
2901360	2903360	Para oraciones muy largas
2903360	2905360	tengo muchísimas combinaciones
2905360	2907360	porque yo acá tengo 2, pero la otra porque son los 1.
2907360	2909360	Donde se empiecen a multiplicar
2909360	2911360	tengo N1 por N2 por N3 por N4
2911360	2913360	según la cantidad de categorías que tenga cada palabra.
2913360	2915360	O sea que tampoco puedo
2915360	2917360	si quiera probarlas todas.
2917360	2919360	Cuanto menos contar.
2919360	2921360	Poder podría, pero sería
2921360	2923360	computacionalmente muy costoso.
2923360	2925360	Podría probar todas las combinaciones, generarlas
2925360	2927360	y contar en cada uno.
2933360	2935360	Dijimos, esa es nuestra tarea.
2935360	2937360	Nosotros queremos la secuencia
2937360	2939360	de TAQ que maximice esa probabilidad.
2945360	2947360	Bueno, pero como computo
2947360	2949360	esta fórmula?
2949360	2951360	Si les parece que ya lo vieron es porque ya lo vieron.
2951360	2953360	Lo vimos para clasificación.
2953360	2955360	Aplico la regla de valles
2955360	2957360	para llevarlo a otras probabilidades
2957360	2959360	que son más fáciles de computar.
2959360	2961360	Entonces, damos vuelta
2961360	2963360	la fórmula
2963360	2965360	y como nos va a quedar?
2965360	2967360	Nos va a quedar
2967360	2969360	la probabilidad
2969360	2971360	de la secuencia
2971360	2973360	de TAQs dada la secuencia
2973360	2975360	de palabras
2975360	2977360	es igual a la probabilidad
2977360	2979360	de la secuencia de palabras
2979360	2981360	dada la secuencia
2981360	2983360	de TAQs
2983360	2985360	por la probabilidad de la secuencia de TAQs
2985360	2987360	dividida la secuencia de palabras.
2989360	2991360	Y fíjense
2991360	2993360	que lo que me queda acá es
2997360	2999360	Parece como un problema más complicado todavía
2999360	3001360	porque es
3001360	3003360	dada una secuencia de TAQs
3003360	3005360	¿Qué tan probable es
3005360	3007360	que esos TAQs sean esas palabras?
3007360	3009360	¿Qué tan probable son que esos TAQs
3009360	3011360	sean las palabras?
3011360	3013360	¿De acuerdo?
3013360	3015360	O sea, de todas las veces
3015360	3017360	que aparecieron estas secuencias de TAQs
3017360	3019360	¿Cuántas veces eran esas las palabras?
3019360	3021360	Seguimos teniendo un problema de decir
3021360	3023360	porque está claro que no podemos contar eso, ¿no?
3023360	3025360	Pero además lo vimos vuelta
3025360	3027360	y por otra parte la secuencia de TAQs
3027360	3029360	¿Qué tan común es la secuencia de TAQs?
3029360	3031360	Esto parece un poco más razonable.
3031360	3033360	Es más parecido a lo que vimos
3033360	3035360	en la enigrama de la clase pasada.
3039360	3041360	¿Por qué desaparece este de acá abajo?
3041360	3043360	A ver si se acuerdan.
3049360	3051360	¿Por qué no depende
3051360	3053360	de mi argumento?
3053360	3055360	Si yo
3055360	3057360	quiero maximizar esta probabilidad
3057360	3059360	es lo mismo que maximizar esta.
3059360	3061360	Entonces ahora sí, me quedo con estas dos
3061360	3063360	la probabilidad de los TAQs
3063360	3065360	por la probabilidad de las palabras.
3065360	3067360	¿De acuerdo?
3068360	3070360	Eso es lo que vamos a querer calcular.
3079360	3081360	Igual sigue teniendo muchos problemas
3081360	3083360	como decíamos, ¿no?
3083360	3085360	Porque yo tengo que ver todas las combinaciones posibles.
3085360	3087360	Yo podría llegar a contar en un corpus
3087360	3089360	de todas las veces que apareció T1 o TN
3089360	3091360	o sea, todas las veces que apareció
3091360	3093360	determinante nombre
3093360	3095360	por ejemplo, determinante
3095360	3097360	adjetivo, nombre, verbo.
3099360	3101360	¿Cuál de todas esas veces
3105360	3107360	¿Cuál de todas esas veces
3107360	3109360	esto generó
3109360	3111360	el lindo perro
3111360	3113360	conmigo la comida?
3115360	3117360	Es eso lo que estoy contando.
3117360	3119360	Multiplicado el mapa
3119360	3121360	por la probabilidad de que esa secuencia de TAQ
